<?xml version="1.0" encoding="UTF-8"?>
<program
  name="cs"
  parent="cs-core"
  xmlns="https://csmp.missouriwestern.edu"
  xmlns:xsi="http://www.w3.org/2001/XMLSchema-instance"
  xsi:schemaLocation="https://csmp.missouriwestern.edu/xml/curriculum/mwsu_curriculum/transformations/program.xsd">
  <section header="Computer Information Systems Concentration">
    <requirement>
      <disjunction>
        <course><subject>MAT</subject><number>167</number></course>
        <conjunction>
          <course><subject>MAT</subject><number>165</number></course>
          <course><subject>MAT</subject><number>166</number></course>
        </conjunction>
      </disjunction>
    </requirement>
    <requirement><course><subject>CSC</subject><number>208</number></course></requirement>
    <requirement><course><subject>CSC</subject><number>384</number></course></requirement>
    <requirement><course><subject>CSC</subject><number>318</number></course></requirement>
    <requirement><course><subject>CSC</subject><number>386</number></course></requirement>
  </section>
  <section header="PLUS--9 credits of ACT, CSC, or MAT courses numbered 300 - 599">
    <blank>3</blank>
    <blank>3</blank>
    <blank>3</blank>
  </section>
</program>
